category_id,category_name,,country,description,followers,join_date,location,picture_url,profile_url,title,trailer_title,trailer_url,videos2,Autos & Vehicles,UCp68_FLety0O-n9QU6phsgw,Great-Britain,"This channel is the home of crazy inventions, brilliant world records and constant disregard to health and safety. I guarantee you will not be disappointed with the videos uploaded as there some of the best and most original on the net and it is TV shows that copy me not the other way round. Thanks and hope you have enjoyed the ride.THE BEST CHANNEL ON YOUTUBE",6828443,11/15/06,,https://yt3.ggpht.com/a-/AN66SAxuyqULKvDT3Qb8ta7bMMZoXaXhE44ahwncIw=s88-mo-c-c0xffffffff-rj-k-no,http://www.youtube.com/channel/UCp68_FLety0O-n9QU6phsgw,colinfurze,TurboJet Powered Scooter-IT'S ALIVE,https://www.youtube.com/watch?v=N39uwTykTQk,2472,Autos & Vehicles,UCjOl2AUblVmg2rA_cRgZkFg,Great-Britain,"Welcome to the official home of Top Gear on YouTube. Here you will find all the best clips from your favourite episodes, whether that's Ken Block in the Hoonicorn, Matt LeBlanc in the Porsche 911, Rory Reid in the new Ford Mustang or trailers for the new series. You'll find performance reviews in our series Chris Harris Drives, the best power laps from The Stig and super cars being put up against each other in our Drag Races. You can also find official clips going back over the years featuring Jeremy Clarkson, Richard Hammond and James May. Make sure you are subscribed so that you don't miss out on a thing: http://bit.ly/SubscribeToTopGearThis is a channel from BBC Studios, who help fund new BBC programmes.",6089849,3/27/06,,https://yt3.ggpht.com/a-/AN66SAwvdxRAouVwfj6YeFpe-GmLbJ869xe3LHJfXQ=s88-mo-c-c0xffffffff-rj-k-no,http://www.youtube.com/channel/UCjOl2AUblVmg2rA_cRgZkFg,Top Gear,FIRST LOOK: McLaren Speedtail | Top Gear,https://www.youtube.com/watch?v=vPgPipm9rFA,11102,Autos & Vehicles,UCsAegdhiYLEoaFGuJFVrqFQ,United States,"Welcome to the Motor Trend Channel! Watch adrenaline charged test drives, the latest in automotive news, and previews from your favorite Motor Trend shows.Watch FREE full episodes on MotorTrend.com or subscribe to our Premium experience at http://www.motortrendondemand.com/subscribe/freetrial/Problem with your Motor Trend subscription? Reach out to our customer care team at Help@MotorTrendOnDemand.com",5960878,3/11/06,,https://yt3.ggpht.com/a-/AN66SAxQQfsJ947nolmLjNuOuEddH5dQjCqfTgDbuA=s88-mo-c-c0xffffffff-rj-k-no,http://www.youtube.com/channel/UCsAegdhiYLEoaFGuJFVrqFQ,Motor Trend Channel,WORLD‰ÛªS GREATEST DRAG RACE 8...,https://www.youtube.com/watch?v=iQGg9NRun08,21382,Autos & Vehicles,UCes1EvRjcKU4sY_UEavndBw,United States,"Learn how to fix your own car with my easy to follow, step-by-step how to style videos for both beginners and experts. Save money, know the job is getting done properly, and feel great after you fix your own car! I publish new videos around every 10 days so stay tuned!",4281143,7/30/08,,https://yt3.ggpht.com/a-/AN66SAzVNwdZfjMKiyxx1sMfVu5BkkjMXPGXXLisIw=s88-mo-c-c0xffffffff-rj-k-no,http://www.youtube.com/channel/UCes1EvRjcKU4sY_UEavndBw,ChrisFix,Crazy 1 Million Subscriber BURNOUT (Gold Play Button)!!!,https://www.youtube.com/watch?v=FLELBFik3qA,3082,Autos & Vehicles,UCL3IoeeHKzWMxZxhmnmETjw,India,"Hi friend welcome to online job YouTube channelFriends Aapko Hamare channel par inse relative video Milenge1 ration card2 Aadhar card3 Awas Yojana4 Sarkar ki Yojna5 online apply6 technical video7 application review8 unboxing9 trick and tips10 PAN cardFriends is Channel ka maqsad hai Jyada Se Jyada logo ki help karna kuch na kuch naya sikhanaAap Sabhi logo ki support se Hamare channel ne 7 month main 500000 subscribers or 11 month me 1 million subscriber complete Kiye Hain1 ˆ_üˆ__ˆ__ ˆ_¨ˆ´àˆ_â 1.4 ˆ_¨ˆ_Àˆ__ˆ_Àˆ_øˆ_¬ ˆ_üˆ_Âˆ´ˆ_üˆ_¥ˆ´ˆ_¡ˆ__ˆ_àˆ_Âˆ_¡ ˆ_¥ˆ_âˆ_»ˆ´ˆ__ˆ´Ûˆ_Ù ˆ__ˆ´ˆ_Channel create date 26 March 2017ˆ_ ˆ_» ˆ_üˆ__ˆ´Û ˆ_¥ˆ´à ˆ_üˆ_»ˆ´Üˆ_¡ˆ´ˆ_Ù ˆ_¥ˆ´à ˆ__ˆ_Àˆ_ ˆ_Âˆ__ˆ´ˆ__-ˆ_Âˆ__ˆ´ˆ__ ˆ_¤ˆ_¬ˆ´ˆ_øˆ_µˆ__ˆ__Email for business inquiriesonlinejob6282@gmail.com",3461651,10/6/14,,https://yt3.ggpht.com/a-/AN66SAyFDOb-xvrl-k-4RS3CFKjpEvzbfRB_eobDsQ=s88-mo-c-c0xffffffff-rj-k-no,http://www.youtube.com/channel/UCL3IoeeHKzWMxZxhmnmETjw,Online Job,Gas subsidy kaise check Kare mil rahi hai ya nahi,https://www.youtube.com/watch?v=hevJek45tEo,7792,Autos & Vehicles,UCgJRL30YS6XFxq9Ga8W2J3A,Australia,"Mighty Car Mods is an independent automotive series created by a couple of friends, Marty and Moog who started filming videos on Martys mum's driveway in 2007. They've come a long way since then but still have an unwavering focus to show their viewers fantastic automotive projects that they can do themselves at home.The MCM boys make cars, and they make movies. In fact they do it all, including the music, editing, and automotive with some help from their friends along the way.Being completely independent, the boys don't have to answer to anyone except their own creative spirit and their focus is on quality over quantity. It doesn't matter if you have a brand new turbo charged beast, or an old banger found in your grandfathers shed. Mighty Car Mods openly embraces anyone who wants to better themselves and their cars through involvement with the MCM Community.",2836504,1/8/08,,https://yt3.ggpht.com/a-/AN66SAzLkrAgXZ27mLZs3luyMXuEGcpD5u6HAkqiWg=s88-mo-c-c0xffffffff-rj-k-no,http://www.youtube.com/channel/UCgJRL30YS6XFxq9Ga8W2J3A,Mighty Car Mods,Mighty Car Mods Youtube Traile...,https://www.youtube.com/watch?v=F3mOSbc1nRM,4052,Autos & Vehicles,UC5nVgiv6elz5GnS6MTr1tVA,Australia,"SUBMIT VIDS: http://bit.ly/Submit_VidPREMIUM MERCH STORE: https://www.ridezza.com/motomadness/TEE SPRING MERCH: http://bit.ly/Moto_MerchCheck out TubeBuddy for ways to improve your channel: https://www.tubebuddy.com/motomadnessAll content featured on this channel is used with original copyright owners permission. Links to the original video are credited in the description box.",2746373,6/6/07,,https://yt3.ggpht.com/a-/AN66SAyN_p0v0cIOuvqhOTeg5fq4YziFL5HDoezFNQ=s88-mo-c-c0xffffffff-rj-k-no,http://www.youtube.com/channel/UC5nVgiv6elz5GnS6MTr1tVA,Moto Madness,"Funny, Crazy & Weird Things Bikers See, Say & Do 2017",https://www.youtube.com/watch?v=pn71zzJYUGU,10932,Autos & Vehicles,UCZrnmK_rH5hKsNjb2mABBhw,United States,"Welcome to Dekja channel!We are uploading Construction Vehicles toys that children can enjoy.Please visit often to watch the video.We also put in reply to the comments :)Have a happy day with ToyFamily every day !Thank U!Please Subscribe, Like :)",2741377,12/28/15,,https://yt3.ggpht.com/a-/AN66SAwEUJkXnvbiWpkiV9rlUceHLMW4S-WW2wQDOw=s88-mo-c-c0xffffffff-rj-k-no,http://www.youtube.com/channel/UCZrnmK_rH5hKsNjb2mABBhw,Dekja,ˆü£ˆüÐˆüâˆü_ˆüàˆ_Ûˆü´ˆ_öˆüª ˆ_âˆü£ˆ_âˆü_ˆüãˆü_ˆü£ˆ_Î ˆ_âˆü_ˆü´ˆüµ Robocar Poli ˆü£ˆüÐˆüÓˆü±ˆ_äˆüÁ ˆü£ˆüÐˆü_ˆü¢ˆü_ˆü_ˆü_ˆü´ ˆü£ˆüÐˆüÓˆü±ˆü_ˆ_Ûˆü_ˆü´ˆü«ˆüà ˆüãˆü«ˆüÓˆü¥ˆüµˆ_ä ˆü_ˆ_öˆü¤ˆü¢ˆ_ÛˆüÇˆü´ˆüáˆü_ˆüÝˆü´ˆü_ˆü´ˆüàˆüªˆ_äˆü_ˆüÑˆü¡ˆ_Ûˆü´,https://www.youtube.com/watch?v=n93VVXQp7qo,10682,Autos & Vehicles,UCNBbCOuAN1NZAuj0vPe_MkA,Great-Britain,"Car Throttle is the Internet's car community.We're one of the fastest growing YouTube channels for the next generation of young car fans. With over 1 MILLION fans on Facebook, we think you'll enjoy the videos we've got including: Readers' Rides, Car Trivia, Reviews and 2 Guys 1 Car!Subscribe now so you don't miss a thing. And if you want to get in touch, email teamct@carthrottle.com. All messages will be read!",2266790,4/22/09,,https://yt3.ggpht.com/a-/AN66SAwKGxC0o0w1_I5K7LzJzzBfFYXdX__LNvcYUg=s88-mo-c-c0xffffffff-rj-k-no,http://www.youtube.com/channel/UCNBbCOuAN1NZAuj0vPe_MkA,Car Throttle,Driving My First Ferrari [4K],https://www.youtube.com/watch?v=HQ_KpmgFuEY,5442,Autos & Vehicles,UC0PXqiud6dbwOAk8RvslgpQ,,"Video provides the best street car videos around the United States!  We bring the WORLD features & highlights from street races all over the world,  Hot Rod Magazine's Drag Week, Streetcar Takeover, Chicago's King of the Streets, Texas Invitational, Duck's Lights Out & No Mercy radial races, Import vs Domsetics and a TONS of No-Prep races!  Video Gear:  http://www.1320video.com/shop/Facebook: http://facebook.com/1320videosInstagram: https://instagram.com/1320video/Twitter: https://twitter.com/1320videoSubmit your video to us: http://goo.gl/forms/TbQPwl9qFq",2243046,5/17/06,,https://yt3.ggpht.com/a-/AN66SAy4YvQaU71aPBOtmXUDsdG9aYMkFYfTGZuZnw=s88-mo-c-c0xffffffff-rj-k-no,http://www.youtube.com/channel/UC0PXqiud6dbwOAk8RvslgpQ,1320video,This VW Golf Makes 1600 HORSEPOWER!  (Twin Engine & Twin Turbo!),https://www.youtube.com/watch?v=vNCIIr3yLNc,1887